Bikram Karmakar,"",human_rights,Low,Moderate Weak,48,AUS,Low,Management Consulting Services | Other Management Consulting Services,Low,Healthcare Providers Specialists Services| Management Advisory Services| Strategic Planning Consultation Services,Low Moderate,1000.0,low,Conflict Mineral,Data Breach High Incident,Various Consultants & Contractors,309872,Cricket Australia,0.11,48,0.336,0.09444,0.01,0.2238733391856305,2021-10-19 19:22:53 UTC,2021-10-19 19:22:54 UTC,57,0,https://app.frdm.co/supplier_link/signin?linked_company_id=57&supplier_id=309872,,0,,,
Trefor James Pty Ltd,,human_rights,Low,Moderate Weak,48,AUS,Low,"Diagnostic Imaging Centers| Medical Laboratories| Offices of Chiropractors| Offices of Physical, Occupational and Speech Therapists, and Audiologists",Low,Healthcare Providers Specialists Services| Management Advisory Services| Strategic Planning Consultation Services,Low Moderate,15000.0,,Conflict Mineral,BLS Nonfatal| PFAS| Water Pollution Supply Chain| Water Quantity Supply Chain,Medical & Sport Science,309873,Cricket Australia,0.11,48,0.324,0.09444,0.01,0.2238733391856305,2021-10-19 19:23:09 UTC,2021-10-19 19:23:10 UTC,57,0,https://app.frdm.co/supplier_link/signin?linked_company_id=57&supplier_id=309873,"Victoria, 3146",0,,,
MYOwnTHERAPIST (Lou Murray),,human_rights,Low,Moderate Weak,48,AUS,Low,Management Consulting Services | Other Management Consulting Services,Low,Healthcare Providers Specialists Services| Management Advisory Services| Strategic Planning Consultation Services,Low Moderate,14180.0,,Conflict Mineral,Data Breach High Incident,Various Consultants & Contractors,309875,Cricket Australia,0.11,48,0.34800000000000003,0.09444,0.01,0.2238733391856305,2021-10-19 19:23:39 UTC,2021-10-19 19:23:40 UTC,57,0,https://app.frdm.co/supplier_link/signin?linked_company_id=57&supplier_id=309875,,0,,,
The Mind Room,,human_rights,Low,Moderate Weak,48,AUS,Low,Management Consulting Services | Other Management Consulting Services,Low,Healthcare Providers Specialists Services| Management Advisory Services| Strategic Planning Consultation Services,Low Moderate,12000.0,,Conflict Mineral,Data Breach High Incident,Various Consultants & Contractors,23944,Cricket Australia,0.11,48,0.28,0.09444,0.01,0.2238733391856305,2020-02-29 18:53:54 UTC,2021-10-19 19:24:40 UTC,57,0,https://app.frdm.co/supplier_link/signin?linked_company_id=57&supplier_id=23944,"Victoria, 3066",0,,,
Dr Hussain I Khan,"",human_rights,Low,Moderate Weak,48,AUS,Low,Management Consulting Services | Other Management Consulting Services,Low,Healthcare Providers Specialists Services| Management Advisory Services| Strategic Planning Consultation Services,Low Moderate,9099.0,low,Conflict Mineral,Data Breach High Incident,Various Consultants & Contractors,309881,Cricket Australia,0.11,48,0.324,0.09444,0.01,0.2238733391856305,2021-10-19 19:25:26 UTC,2021-10-19 19:25:27 UTC,57,0,https://app.frdm.co/supplier_link/signin?linked_company_id=57&supplier_id=309881,,0,,,
The Accidental Athlete Pty Ltd (Dr Duncan Walker),,human_rights,Low,Moderate Weak,48,AUS,Low,Management Consulting Services | Other Management Consulting Services,Low,Healthcare Providers Specialists Services| Management Advisory Services| Strategic Planning Consultation Services,Low Moderate,6500.0,,Conflict Mineral,Data Breach High Incident,Various Consultants & Contractors,309883,Cricket Australia,0.11,48,0.276,0.09444,0.01,0.2238733391856305,2021-10-19 19:25:55 UTC,2021-10-19 19:25:56 UTC,57,0,https://app.frdm.co/supplier_link/signin?linked_company_id=57&supplier_id=309883,,0,,,
PBM Safety,,human_rights,Low,Moderate Weak,48,AUS,Low,Management Consulting Services | Other Management Consulting Services| Professional and Management Development Training,Low,Management Advisory Services| Occupational Health Or Safety Services| Strategic Planning Consultation Services,Low Moderate,8700.0,,Conflict Mineral,BLS Nonfatal| Data Breach High Incident,Non-Procurement Spend,309922,Cricket Australia,0.11,48,0.29600000000000004,0.09444,0.01,0.2238733391856305,2021-10-19 19:38:54 UTC,2021-10-19 19:38:55 UTC,57,0,https://app.frdm.co/supplier_link/signin?linked_company_id=57&supplier_id=309922,"New South Wales, 2328| New South Wales, 2333",0,,,
PRLX Pty Ltd,,human_rights,Low,Moderate Weak,48,AUS,Low,"Gift, Novelty, and Souvenir Stores| Management Consulting Services | Other Management Consulting Services| Other Services Related to Advertising",Low,Management Advisory Services| Sales and business promotion activities| Strategic Planning Consultation Services,Low Moderate,10370.0,,Conflict Mineral,Data Breach High Incident,Gifts & Promotions| Various Consultants & Contractors,309938,Cricket Australia,0.11,48,0.28400000000000003,0.09444,0.01,0.22382766677718227,2021-10-19 19:42:44 UTC,2021-10-19 19:42:45 UTC,57,0,https://app.frdm.co/supplier_link/signin?linked_company_id=57&supplier_id=309938,"Northern Territory, 0828",0,,,
Silent Sounds,,human_rights,Low,Moderate Weak,48,AUS,Low,Other Commercial and Industrial Machinery and Equipment Rental and Leasing,Low,Audio Visual Services| Computer Hardware Rental Or Leasing Services| Restaurants,Low Moderate,200.0,,,Data Breach Vulnerability| Political Risk Liability,Entertainment / Hospitality,310031,Cricket Australia,0.11,48,0.28400000000000003,0.09444,0.01,0.22386004405251794,2021-10-19 20:10:23 UTC,2021-10-19 20:10:23 UTC,57,0,https://app.frdm.co/supplier_link/signin?linked_company_id=57&supplier_id=310031,,0,,,
Trace Project Management Pty Ltd,,human_rights,Low,Moderate Weak,48,AUS,Low,"All Other Professional, Scientific, and Technical Services| Engineering Services| Management Consulting Services | Surveying and Mapping (Except Geophysical) Services",Low,Management Advisory Services| Professional engineering services| Quantity Surveying Service,Low Moderate,78430.0,medium,,Data Breach High Incident| Water Pollution Supply Chain,Capital| Uncategorised,310051,Cricket Australia,0.11,48,0.268,0.09444,0.01921,0.22437484756194237,2021-10-19 20:15:18 UTC,2021-10-19 20:15:19 UTC,57,0,https://app.frdm.co/supplier_link/signin?linked_company_id=57&supplier_id=310051,"Queensland, 4012",0,,,
NAPIER & BLAKELEY PTY LTD,,human_rights,Low,Moderate Weak,48,AUS,Low,"All Other Professional, Scientific, and Technical Services| Engineering Services| Management Consulting Services | Surveying and Mapping (Except Geophysical) Services",Low,Management Advisory Services| Professional engineering services| Quantity Surveying Service,Low Moderate,55200.0,,,Data Breach High Incident| Water Pollution Supply Chain,Capital,261003,Cricket Australia,0.11,48,0.324,0.09444,0.01921,0.22437484756194237,2021-08-17 17:58:13 UTC,2021-10-19 20:16:10 UTC,57,0,https://app.frdm.co/supplier_link/signin?linked_company_id=57&supplier_id=261003,"Level 8 20 Hunter Street 0 Sydney NSW 2000| Victoria, 3000",0,,,
Theo Doropoulos,,human_rights,Low,Moderate Weak,48,AUS,Low,"Independent Artists, Writers, and Performers",Low,Fencing And Railing Service| Performing arts professionals| Scaffolding services,Low Moderate,900.0,,,Data Breach High Incident,Various Game Related,310166,Cricket Australia,0.11,48,0.30400000000000005,0.09444,0.01,0.2238733391856305,2021-10-19 20:52:34 UTC,2021-10-19 20:52:35 UTC,57,0,https://app.frdm.co/supplier_link/signin?linked_company_id=57&supplier_id=310166,"AU, 3013",0,,,
SPL Security Solutions Pty Ltd,,human_rights,Low,Moderate Weak,53,AUS,Low,Other Services to Buildings and Dwellings| Security Guards and Patrol Services| Security Systems Services (Except Locksmiths),Low,Fire Detection And Burglar Alarm Systems Installation Service| Security Guard Services,Low Moderate,3477.0,,,Australia MSA| Conflict Mineral| Data Breach Vulnerability,Security,310245,Cricket Australia,0.11,53,0.31200000000000006,0.09444,0.01,0.34088465080356595,2021-10-19 21:20:00 UTC,2021-10-19 21:20:01 UTC,57,0,https://app.frdm.co/supplier_link/signin?linked_company_id=57&supplier_id=310245,"Queensland, 4217",0,,Low,0.0
Stage And Screen Travel Services,"",human_rights,Low,Moderate Weak,48,AUS,Low,All Other Travel Arrangement and Reservation Services| Travel Agencies,Low,Hotel Rooms| Hotels| Limousine Or Town Car Service| Passenger Air Transportation| Taxicab Services| Travel Agencies,Low Moderate,1300000.0,high,,Data Breach Vulnerability,Domestic Various Travel| Top50,310292,Cricket Australia,0.11,48,0.3,0.09444,0.01,0.2238733391856306,2021-10-19 21:36:16 UTC,2021-10-19 21:36:17 UTC,57,0,https://app.frdm.co/supplier_link/signin?linked_company_id=57&supplier_id=310292,,0,,,
Adelaide University Sports Association,"",human_rights,Low,Moderate Weak,38,AUS,Low,"Colleges, Universities, and Professional Schools",Low,,,1100.0,low,,BLS Nonfatal,,684940,Cricket Australia,0.11,38,0.21600000000000003,0.09444,0.01,,2025-06-23 04:20:29 UTC,2025-06-23 04:20:29 UTC,57,0,https://app.frdm.co/supplier_link/signin?linked_company_id=57&supplier_id=684940,,0,,,
Alexandra Nihill,"",human_rights,Low,Moderate Weak,38,AUS,Low,Marketing Consulting Services,Low,,,15000.0,,,Data Breach High Incident,,684944,Cricket Australia,0.11,38,0.20800000000000002,0.09444,0.01,,2025-06-23 04:27:47 UTC,2025-06-23 04:27:47 UTC,57,0,https://app.frdm.co/supplier_link/signin?linked_company_id=57&supplier_id=684944,,0,,,
Analyst Economy Pty Ltd,"",human_rights,Low,Moderate Weak,38,AUS,Low,Marketing Consulting Services,Low,,,20000.0,,,Data Breach High Incident,,684949,Cricket Australia,0.11,38,0.20400000000000001,0.09444,0.01,,2025-06-23 04:33:17 UTC,2025-06-23 04:33:17 UTC,57,0,https://app.frdm.co/supplier_link/signin?linked_company_id=57&supplier_id=684949,,0,,,
ANZSLA,"",human_rights,Low,Moderate Weak,38,AUS,Low,"Promoters of Performing Arts, Sports, and Similar Events With Facilities",Low,,,8000.0,low,,Data Breach High Incident,,310287,Cricket Australia,0.11,38,0.21200000000000002,0.09444,0.01,,2021-10-19 21:34:32 UTC,2025-06-23 04:35:06 UTC,57,0,https://app.frdm.co/supplier_link/signin?linked_company_id=57&supplier_id=310287,,0,,,
Assetpro,"",human_rights,Low,Moderate Weak,38,AUS,Low,Security Guards and Patrol Services,Low,,,151000.0,high,,Australia MSA| Data Breach Vulnerability,,684953,Cricket Australia,0.11,38,0.21200000000000002,0.09444,0.01,,2025-06-23 04:43:30 UTC,2025-06-23 04:43:30 UTC,57,0,https://app.frdm.co/supplier_link/signin?linked_company_id=57&supplier_id=684953,,0,,,
Aussie Party Hire,"",human_rights,Low,Moderate Weak,38,AUS,Low,All Other Consumer Goods Rental,Low,,,4700.0,low,,Data Breach Vulnerability| Political Risk Liability,,684955,Cricket Australia,0.11,38,0.20800000000000002,0.09444,0.01,,2025-06-23 04:46:30 UTC,2025-06-23 04:46:30 UTC,57,0,https://app.frdm.co/supplier_link/signin?linked_company_id=57&supplier_id=684955,,0,,,
AUSTRALIAN INTERNATIONAL SPORTS ORGANISATION PTY LTD,"",human_rights,Low,Moderate Weak,38,AUS,Low,Professional Organizations,Low,,,2400.0,low,,Data Breach High Incident| Data Breach Vulnerability,,557186,Cricket Australia,0.11,38,0.20400000000000001,0.09444,0.01,,2023-03-07 23:58:59 UTC,2025-06-23 04:48:56 UTC,57,0,https://app.frdm.co/supplier_link/signin?linked_company_id=57&supplier_id=557186,,0,,,
Belinda Clark,"",human_rights,Low,Moderate Weak,38,AUS,Low,Marketing Consulting Services,Low,,,20000.0,low,,Data Breach High Incident,,684960,Cricket Australia,0.11,38,0.20800000000000002,0.09444,0.01,,2025-06-23 05:04:38 UTC,2025-06-23 05:04:38 UTC,57,0,https://app.frdm.co/supplier_link/signin?linked_company_id=57&supplier_id=684960,,0,,,
Bergs Productions,"",human_rights,Low,Moderate Weak,38,AUS,Low,Motion Picture and Video Production,Low,,,18000.0,low,,Data Breach High Incident| Political Risk Liability| Water Quantity Supply Chain,,684961,Cricket Australia,0.11,38,0.20400000000000001,0.09444,0.01,,2025-06-23 05:05:31 UTC,2025-06-23 05:05:31 UTC,57,0,https://app.frdm.co/supplier_link/signin?linked_company_id=57&supplier_id=684961,,0,,,
Beth Mooney,"",human_rights,Low,Moderate Weak,38,AUS,Low,Marketing Consulting Services,Low,,,150000.0,high,,Data Breach High Incident,,684962,Cricket Australia,0.11,38,0.2,0.09444,0.01,,2025-06-23 05:06:35 UTC,2025-06-23 05:06:35 UTC,57,0,https://app.frdm.co/supplier_link/signin?linked_company_id=57&supplier_id=684962,,0,,,
Blue River Ice,"",human_rights,Low,Moderate Weak,38,AUS,Low,Food Service Contractors,Low,,,600.0,low,,BLS Nonfatal| UK MSA| Water Pollution Supply Chain| Water Quantity Supply Chain,,684963,Cricket Australia,0.11,38,0.2,0.09444,0.01,,2025-06-23 05:08:33 UTC,2025-06-23 05:08:33 UTC,57,0,https://app.frdm.co/supplier_link/signin?linked_company_id=57&supplier_id=684963,,0,,,
Bonetti,"",human_rights,Low,Moderate Weak,38,AUS,Low,General Rental Centers,Low,,,6500.0,low,,Data Breach Vulnerability| Political Risk Liability,,684965,Cricket Australia,0.11,38,0.21600000000000003,0.09444,0.01,,2025-06-23 05:11:21 UTC,2025-06-23 05:11:21 UTC,57,0,https://app.frdm.co/supplier_link/signin?linked_company_id=57&supplier_id=684965,,0,,,
Brisbane Lions Australian Football Club,"",human_rights,Low,Moderate Weak,38,AUS,Low,Sports Teams and Clubs,Low,,,52000.0,medium,,Data Breach High Incident,,684969,Cricket Australia,0.11,38,0.2,0.09444,0.01259,,2025-06-23 05:15:32 UTC,2025-06-23 05:15:32 UTC,57,0,https://app.frdm.co/supplier_link/signin?linked_company_id=57&supplier_id=684969,,0,,,
City of Gold Coast,"",human_rights,Low,Moderate Weak,38,AUS,Low,Other General Government Support,Low,,,500.0,low,,BLS Nonfatal,,684977,Cricket Australia,0.11,38,0.20800000000000002,0.09444,0.01,,2025-06-23 05:50:55 UTC,2025-06-23 05:50:55 UTC,57,0,https://app.frdm.co/supplier_link/signin?linked_company_id=57&supplier_id=684977,,0,,,
Clancy Sinnamon,"",human_rights,Low,Moderate Weak,38,AUS,Low,Marketing Consulting Services,Low,,,400.0,low,,Data Breach High Incident,,684979,Cricket Australia,0.11,38,0.2,0.09444,0.01,,2025-06-23 05:53:29 UTC,2025-06-23 05:53:29 UTC,57,0,https://app.frdm.co/supplier_link/signin?linked_company_id=57&supplier_id=684979,,0,,,
Cricket Centre,"",human_rights,Low,Moderate Weak,38,AUS,Low,Sports Teams and Clubs,Low,,,500.0,low,,Data Breach High Incident,,684989,Cricket Australia,0.11,38,0.21600000000000003,0.09444,0.01259,,2025-06-23 06:05:55 UTC,2025-06-23 06:05:55 UTC,57,0,https://app.frdm.co/supplier_link/signin?linked_company_id=57&supplier_id=684989,,0,,,
Cudgen Headland SLSC,"",human_rights,Low,Moderate Weak,38,AUS,Low,Facilities Support Services,Low,,,600.0,low,,Data Breach Vulnerability,,684991,Cricket Australia,0.11,38,0.20800000000000002,0.09444,0.01,,2025-06-23 06:09:16 UTC,2025-06-23 06:09:16 UTC,57,0,https://app.frdm.co/supplier_link/signin?linked_company_id=57&supplier_id=684991,,0,,,
DITEC AUTOMATIC ENTRANCE SPECIALISTS PTY LTD (ABILITY AUTO D,"",human_rights,Low,Moderate Weak,38,AUS,Low,Facilities Support Services,Low,,,3000.0,low,,Data Breach Vulnerability,,687620,Cricket Australia,0.11,38,0.20800000000000002,0.09444,0.01,,2025-06-26 03:56:51 UTC,2025-06-26 03:56:51 UTC,57,0,https://app.frdm.co/supplier_link/signin?linked_company_id=57&supplier_id=687620,,0,,,
Eastern Suburbs District Rugby League Football Club Ltd,"",human_rights,Low,Moderate Weak,38,AUS,Low,Sports Teams and Clubs,Low,,,64000.0,medium,,Data Breach High Incident,,687625,Cricket Australia,0.11,38,0.20800000000000002,0.09444,0.01259,,2025-06-26 07:02:41 UTC,2025-06-26 07:02:41 UTC,57,0,https://app.frdm.co/supplier_link/signin?linked_company_id=57&supplier_id=687625,,0,,,
Evan Bancroft,"",human_rights,Low,Moderate Weak,38,AUS,Low,"Agents and Managers for Artists, Athletes, Entertainers, and Other Public Figures",Low,,,3200.0,low,,Data Breach High Incident,,687630,Cricket Australia,0.11,38,0.2,0.09444,0.01,,2025-06-26 09:49:07 UTC,2025-06-26 09:49:08 UTC,57,0,https://app.frdm.co/supplier_link/signin?linked_company_id=57&supplier_id=687630,,0,,,
Event Artillery Pty Ltd,"",human_rights,Low,Moderate Weak,38,AUS,Low,"Promoters of Performing Arts, Sports, and Similar Events With Facilities",Low,,,25000.0,medium,,Data Breach High Incident,,687631,Cricket Australia,0.11,38,0.2,0.09444,0.01,,2025-06-26 09:52:12 UTC,2025-06-26 09:52:12 UTC,57,0,https://app.frdm.co/supplier_link/signin?linked_company_id=57&supplier_id=687631,,0,,,
Event Medical Plus,"",human_rights,Low,Moderate Weak,38,AUS,Low,All Other Miscellaneous Ambulatory Health Care Services,Low,,,15000.0,low,,BLS Nonfatal| Water Pollution Supply Chain| Water Quantity Supply Chain,,687633,Cricket Australia,0.11,38,0.20800000000000002,0.09444,0.01,,2025-06-26 10:04:52 UTC,2025-06-26 10:04:52 UTC,57,0,https://app.frdm.co/supplier_link/signin?linked_company_id=57&supplier_id=687633,,0,,,
Event Rentals,"",human_rights,Low,Moderate Weak,38,AUS,Low,"Promoters of Performing Arts, Sports, and Similar Events Without Facilities",Low,,,16000.0,low,,Data Breach High Incident,,687634,Cricket Australia,0.11,38,0.2,0.09444,0.01,,2025-06-26 10:07:43 UTC,2025-06-26 10:07:44 UTC,57,0,https://app.frdm.co/supplier_link/signin?linked_company_id=57&supplier_id=687634,,0,,,
Fiona Clarke,"",human_rights,Low,Moderate Weak,38,AUS,Low,"Independent Artists, Writers, and Performers",Low,,,10000.0,low,,Data Breach High Incident,,687641,Cricket Australia,0.11,38,0.20400000000000001,0.09444,0.01,,2025-06-26 11:04:12 UTC,2025-06-26 11:04:12 UTC,57,0,https://app.frdm.co/supplier_link/signin?linked_company_id=57&supplier_id=687641,,0,,,
Kedron-Wavell Services Club,"",human_rights,Low,Moderate Weak,38,AUS,Low,"Arts, Entertainment, and Recreation",Low,,,22000.0,low,,Data Breach High Incident,,687676,Cricket Australia,0.11,38,0.22,0.09444,0.0,,2025-06-29 10:33:44 UTC,2025-06-29 10:33:44 UTC,57,0,https://app.frdm.co/supplier_link/signin?linked_company_id=57&supplier_id=687676,,0,,,
LATUS MD PTY LTD,"",human_rights,Low,Moderate Weak,38,AUS,Low,Offices of Physicians,Low,,,233000.0,medium,,BLS Nonfatal| Water Pollution Supply Chain| Water Quantity Supply Chain,,687681,Cricket Australia,0.11,38,0.2,0.09444,0.01,,2025-06-29 10:58:48 UTC,2025-06-29 10:58:48 UTC,57,0,https://app.frdm.co/supplier_link/signin?linked_company_id=57&supplier_id=687681,,0,,,
Legends Global Hospitality Australia Pty Ltd,"",human_rights,Low,Moderate Weak,38,AUS,Low,"Office Supplies, Stationery, and Gift Stores",Low,,,15700.0,low,,Deforestation,,687685,Cricket Australia,0.11,38,0.20400000000000001,0.09444,0.01256,,2025-06-29 11:06:15 UTC,2025-06-29 11:06:15 UTC,57,0,https://app.frdm.co/supplier_link/signin?linked_company_id=57&supplier_id=687685,,0,,,
Marron Media Group Pty Ltd,"",human_rights,Low,Moderate Weak,38,AUS,Low,Media Buying Agencies,Low,,,118000.0,medium,,Data Breach High Incident| Water Quantity Supply Chain,,687694,Cricket Australia,0.11,38,0.20400000000000001,0.09444,0.01,,2025-06-29 11:34:26 UTC,2025-06-29 11:34:26 UTC,57,0,https://app.frdm.co/supplier_link/signin?linked_company_id=57&supplier_id=687694,,0,,,
Masterpiesse Sports Promotions,"",human_rights,Low,Moderate Weak,38,AUS,Low,"Advertising Agencies| Promoters of Performing Arts, Sports, and Similar Events Without Facilities",Low,,,1800.0,low,,Data Breach High Incident| Water Quantity Supply Chain,,687696,Cricket Australia,0.11,38,0.20800000000000002,0.09444,0.01,,2025-06-29 11:38:32 UTC,2025-06-29 11:38:32 UTC,57,0,https://app.frdm.co/supplier_link/signin?linked_company_id=57&supplier_id=687696,,0,,,
Matthew Thomas Industries Pty Ltd (Matthew Renshaw),"",human_rights,Low,Moderate Weak,38,AUS,Low,"Agents and Managers for Artists, Athletes, Entertainers, and Other Public Figures",Low,,,90000.0,medium,,Data Breach High Incident,,687699,Cricket Australia,0.11,38,0.20400000000000001,0.09444,0.01,,2025-06-29 11:51:06 UTC,2025-06-29 11:51:06 UTC,57,0,https://app.frdm.co/supplier_link/signin?linked_company_id=57&supplier_id=687699,,0,,,
Maximum Group International PTY LTD,"",human_rights,Low,Moderate Weak,38,AUS,Low,"Agents and Managers for Artists, Athletes, Entertainers, and Other Public Figures",Low,,,1000.0,low,,Data Breach High Incident,,687700,Cricket Australia,0.11,38,0.20400000000000001,0.09444,0.01,,2025-06-29 11:53:12 UTC,2025-06-29 11:53:12 UTC,57,0,https://app.frdm.co/supplier_link/signin?linked_company_id=57&supplier_id=687700,,0,,,
TRM Partners,,human_rights,Low,Moderate Weak,48,AUS| GBR,Low,Advertising Agencies| Marketing Consulting Services| Media Representatives,Low,Advertising| Advertising Campaign Services| Advertising Production Service| Brand marketing or advertising instructional materials,Low,583452.0,,Deforestation,Data Breach High Incident| Water Quantity Supply Chain,Various Advertising & Marketing,309828,Cricket Australia,0.1,48,0.30400000000000005,0.11939,0.01,0.17799684592303996,2021-10-19 19:11:16 UTC,2021-10-19 19:11:16 UTC,57,0,https://app.frdm.co/supplier_link/signin?linked_company_id=57&supplier_id=309828,"4021 W CIELO GRANDE, GLENDALE, Maricopa, AZ, 85310",0,,,
Rocknbob Media House,,human_rights,Low,Moderate Weak,54,AUS,Low,Management Consulting Services | Other Management Consulting Services,Low,Management Advisory Services| Strategic Planning Consultation Services,Low Moderate,300.0,,Conflict Mineral,Data Breach High Incident,Various Consultants & Contractors,309866,Cricket Australia,0.1,54,0.336,0.09444,0.01,0.28583828128165323,2021-10-19 19:21:24 UTC,2021-10-19 19:21:24 UTC,57,0,https://app.frdm.co/supplier_link/signin?linked_company_id=57&supplier_id=309866,"",0,,Low,0.0
Trent Woodhill,,human_rights,Low,Moderate Weak,54,AUS,Low,Management Consulting Services | Other Management Consulting Services| Sports and Recreation Instruction,Low,Management Advisory Services| Strategic Planning Consultation Services,Low Moderate,82885.0,,Conflict Mineral,BLS Nonfatal| Data Breach High Incident,Coaching / Team Management| Various Consultants & Contractors,309897,Cricket Australia,0.1,54,0.29200000000000004,0.09444,0.01,0.28583828128165323,2021-10-19 19:31:17 UTC,2021-10-19 19:31:18 UTC,57,0,https://app.frdm.co/supplier_link/signin?linked_company_id=57&supplier_id=309897,"AU, 2224",0,,Low,0.0
Chris Rubick Pty Ltd,"",human_rights,Low,Moderate Weak,49,AUS,Low,Human Resources Consulting Services| Management Consulting Services | Other Management Consulting Services,Low,Human Resource Development| Management Advisory Services| Management Development| Strategic Planning Consultation Services,Low,14000.0,low,Conflict Mineral,Data Breach High Incident,Recruitment| Various Consultants & Contractors,309904,Cricket Australia,0.1,49,0.316,0.09444,0.01,0.19289086813761916,2021-10-19 19:33:27 UTC,2021-10-19 19:33:27 UTC,57,0,https://app.frdm.co/supplier_link/signin?linked_company_id=57&supplier_id=309904,"Victoria, 3040",0,,,
Warren Kennaugh,,human_rights,Low,Moderate Weak,49,AUS,Low,Human Resources Consulting Services| Management Consulting Services | Other Management Consulting Services,Low,Human Resource Development| Management Advisory Services| Management Development| Strategic Planning Consultation Services,Low,21200.0,,Conflict Mineral,Data Breach High Incident,Various Consultants & Contractors,309906,Cricket Australia,0.1,49,0.32800000000000007,0.09444,0.01,0.19289086813761916,2021-10-19 19:34:22 UTC,2021-10-19 19:34:22 UTC,57,0,https://app.frdm.co/supplier_link/signin?linked_company_id=57&supplier_id=309906,"New South Wales, 2119",0,,,
Rice Warner Pty Ltd,,human_rights,Low,Moderate Weak,54,AUS,Low,Management Consulting Services | Other Management Consulting Services,Low,Management Advisory Services| Strategic Planning Consultation Services,Low Moderate,15000.0,,Conflict Mineral,Data Breach High Incident,Various Consultants & Contractors,309909,Cricket Australia,0.1,54,0.3,0.09444,0.01,0.28583828128165323,2021-10-19 19:35:05 UTC,2021-10-19 19:35:06 UTC,57,0,https://app.frdm.co/supplier_link/signin?linked_company_id=57&supplier_id=309909,"New South Wales, 2223| SYDNEY, New South Wales, 2000, Australia",0,,Low,0.0
Warren Dowley,,human_rights,Low,Moderate Weak,48,AUS,Low,Advertising Agencies| Management Consulting Services | Other Management Consulting Services,Low,Advertising| Advertising Agency Services| Advertising Production Service| Brand marketing or advertising instructional materials| Management Advisory Services| Promotional Or Advertising Printing| Strategic Planning Consultation Services,Low,72625.0,,Conflict Mineral| Deforestation,Data Breach High Incident| Water Quantity Supply Chain,Production,309927,Cricket Australia,0.1,48,0.29200000000000004,0.09444,0.01,0.19765820017843594,2021-10-19 19:40:06 UTC,2021-10-19 19:40:07 UTC,57,0,https://app.frdm.co/supplier_link/signin?linked_company_id=57&supplier_id=309927,10354 DOWNEY AVE| 10354 DOWNEY AVE DOWNEY CA  90241,0,,,
Shivashankar Ranjit,,human_rights,Low,Moderate Weak,54,AUS,Low,Management Consulting Services | Other Management Consulting Services,Low,Management Advisory Services| Strategic Planning Consultation Services,Low Moderate,7800.0,,Conflict Mineral,Data Breach High Incident,Various Consultants & Contractors,309945,Cricket Australia,0.1,54,0.31200000000000006,0.09444,0.01,0.28583828128165323,2021-10-19 19:44:24 UTC,2021-10-19 19:44:25 UTC,57,0,https://app.frdm.co/supplier_link/signin?linked_company_id=57&supplier_id=309945,"AU, 3181",0,,Low,0.0
Mat Jones,,human_rights,Low,Moderate Weak,48,AUS,Low,Advertising Agencies| Management Consulting Services | Other Management Consulting Services,Low,Advertising| Advertising Agency Services| Advertising Production Service| Brand marketing or advertising instructional materials| Management Advisory Services| Promotional Or Advertising Printing| Strategic Planning Consultation Services,Low,3000.0,,Conflict Mineral| Deforestation,Data Breach High Incident| Water Quantity Supply Chain,Production,309954,Cricket Australia,0.1,48,0.26,0.09444,0.01,0.19765820017843594,2021-10-19 19:46:30 UTC,2021-10-19 19:46:30 UTC,57,0,https://app.frdm.co/supplier_link/signin?linked_company_id=57&supplier_id=309954,,0,,,
